{
  "format": "open-values-register-entity-map",
  "version": "1.0.0",
  "registerId": "cfpb-complaints",
  "updated": "2026-08-14",
  "note": "Reviewed exact company crosswalk for three bounded CFPB product aggregates. It stages raw counts as evidence only; it does not make complaint volume rate-comparable across differently sized firms.",
  "mappings": [
    {
      "cid": "banking",
      "entityCode": "ally",
      "entityName": "Ally Bank",
      "entityIdentitySha256": "51ba25290b8e7054d3753b7c24b23619c95e0bdf843c35fad31cd3f6870bb059",
      "status": "matched",
      "legalName": "ALLY FINANCIAL INC.",
      "aliases": [
        "ALLY FINANCIAL INC.",
        "Ally Bank"
      ],
      "jurisdiction": "US",
      "registerIdentifier": {
        "scheme": "cfpb-company-product",
        "value": "Checking or savings account|ALLY FINANCIAL INC.",
        "url": "https://www.consumerfinance.gov/data-research/consumer-complaints/search/api/v1/?company=ALLY+FINANCIAL+INC.&date_received_max=2025-12-31&date_received_min=2024-01-01&product=Checking+or+savings+account&size=0"
      },
      "matchEvidence": {
        "source": "https://www.consumerfinance.gov/data-research/consumer-complaints/search/api/v1/?company=ALLY+FINANCIAL+INC.&date_received_max=2025-12-31&date_received_min=2024-01-01&product=Checking+or+savings+account&size=0",
        "note": "Reviewed brand-to-company crosswalk. The selected company key appears exactly in the bounded CFPB product aggregation; no fuzzy name matching is used.",
        "accessed": "2026-08-14"
      },
      "review": {
        "by": "Codex Phase 7 exact company review",
        "on": "2026-08-14"
      }
    },
    {
      "cid": "banking",
      "entityCode": "bofa",
      "entityName": "Bank of America",
      "entityIdentitySha256": "85012fa3d23c9e0cf560ab1fab46f1cc9e43c5425890b353fd950f42cd2c941f",
      "status": "matched",
      "legalName": "BANK OF AMERICA, NATIONAL ASSOCIATION",
      "aliases": [
        "BANK OF AMERICA, NATIONAL ASSOCIATION",
        "Bank of America"
      ],
      "jurisdiction": "US",
      "registerIdentifier": {
        "scheme": "cfpb-company-product",
        "value": "Checking or savings account|BANK OF AMERICA, NATIONAL ASSOCIATION",
        "url": "https://www.consumerfinance.gov/data-research/consumer-complaints/search/api/v1/?company=BANK+OF+AMERICA%2C+NATIONAL+ASSOCIATION&date_received_max=2025-12-31&date_received_min=2024-01-01&product=Checking+or+savings+account&size=0"
      },
      "matchEvidence": {
        "source": "https://www.consumerfinance.gov/data-research/consumer-complaints/search/api/v1/?company=BANK+OF+AMERICA%2C+NATIONAL+ASSOCIATION&date_received_max=2025-12-31&date_received_min=2024-01-01&product=Checking+or+savings+account&size=0",
        "note": "Reviewed brand-to-company crosswalk. The selected company key appears exactly in the bounded CFPB product aggregation; no fuzzy name matching is used.",
        "accessed": "2026-08-14"
      },
      "review": {
        "by": "Codex Phase 7 exact company review",
        "on": "2026-08-14"
      }
    },
    {
      "cid": "banking",
      "entityCode": "capital-one",
      "entityName": "Capital One",
      "entityIdentitySha256": "8eb2f74aa02811e75f5e5617719b5d20ed1b30af40daeeead2a632eee063ec2b",
      "status": "matched",
      "legalName": "CAPITAL ONE FINANCIAL CORPORATION",
      "aliases": [
        "CAPITAL ONE FINANCIAL CORPORATION",
        "Capital One"
      ],
      "jurisdiction": "US",
      "registerIdentifier": {
        "scheme": "cfpb-company-product",
        "value": "Checking or savings account|CAPITAL ONE FINANCIAL CORPORATION",
        "url": "https://www.consumerfinance.gov/data-research/consumer-complaints/search/api/v1/?company=CAPITAL+ONE+FINANCIAL+CORPORATION&date_received_max=2025-12-31&date_received_min=2024-01-01&product=Checking+or+savings+account&size=0"
      },
      "matchEvidence": {
        "source": "https://www.consumerfinance.gov/data-research/consumer-complaints/search/api/v1/?company=CAPITAL+ONE+FINANCIAL+CORPORATION&date_received_max=2025-12-31&date_received_min=2024-01-01&product=Checking+or+savings+account&size=0",
        "note": "Reviewed brand-to-company crosswalk. The selected company key appears exactly in the bounded CFPB product aggregation; no fuzzy name matching is used.",
        "accessed": "2026-08-14"
      },
      "review": {
        "by": "Codex Phase 7 exact company review",
        "on": "2026-08-14"
      }
    },
    {
      "cid": "banking",
      "entityCode": "chase",
      "entityName": "JPMorgan Chase",
      "entityIdentitySha256": "bd6b1134de26846e687741d3cd5b785323130a94addf43da57e2ff3e53d9d2fe",
      "status": "matched",
      "legalName": "JPMORGAN CHASE & CO.",
      "aliases": [
        "JPMORGAN CHASE & CO.",
        "JPMorgan Chase"
      ],
      "jurisdiction": "US",
      "registerIdentifier": {
        "scheme": "cfpb-company-product",
        "value": "Checking or savings account|JPMORGAN CHASE & CO.",
        "url": "https://www.consumerfinance.gov/data-research/consumer-complaints/search/api/v1/?company=JPMORGAN+CHASE+%26+CO.&date_received_max=2025-12-31&date_received_min=2024-01-01&product=Checking+or+savings+account&size=0"
      },
      "matchEvidence": {
        "source": "https://www.consumerfinance.gov/data-research/consumer-complaints/search/api/v1/?company=JPMORGAN+CHASE+%26+CO.&date_received_max=2025-12-31&date_received_min=2024-01-01&product=Checking+or+savings+account&size=0",
        "note": "Reviewed brand-to-company crosswalk. The selected company key appears exactly in the bounded CFPB product aggregation; no fuzzy name matching is used.",
        "accessed": "2026-08-14"
      },
      "review": {
        "by": "Codex Phase 7 exact company review",
        "on": "2026-08-14"
      }
    },
    {
      "cid": "banking",
      "entityCode": "chime",
      "entityName": "Chime",
      "entityIdentitySha256": "d31dd77bb9581c43692e40e77e401b371d8902bcfad1ff498b4ef54cf9ee069c",
      "status": "matched",
      "legalName": "Chime Financial Inc",
      "aliases": [
        "Chime",
        "Chime Financial Inc"
      ],
      "jurisdiction": "US",
      "registerIdentifier": {
        "scheme": "cfpb-company-product",
        "value": "Checking or savings account|Chime Financial Inc",
        "url": "https://www.consumerfinance.gov/data-research/consumer-complaints/search/api/v1/?company=Chime+Financial+Inc&date_received_max=2025-12-31&date_received_min=2024-01-01&product=Checking+or+savings+account&size=0"
      },
      "matchEvidence": {
        "source": "https://www.consumerfinance.gov/data-research/consumer-complaints/search/api/v1/?company=Chime+Financial+Inc&date_received_max=2025-12-31&date_received_min=2024-01-01&product=Checking+or+savings+account&size=0",
        "note": "Reviewed brand-to-company crosswalk. The selected company key appears exactly in the bounded CFPB product aggregation; no fuzzy name matching is used.",
        "accessed": "2026-08-14"
      },
      "review": {
        "by": "Codex Phase 7 exact company review",
        "on": "2026-08-14"
      }
    },
    {
      "cid": "banking",
      "entityCode": "citi",
      "entityName": "Citibank",
      "entityIdentitySha256": "4632e39f29d27bafacd4fbf2d36cb947fb2119173fe34c4a63edeb941e4747e3",
      "status": "matched",
      "legalName": "CITIBANK, N.A.",
      "aliases": [
        "CITIBANK, N.A.",
        "Citibank"
      ],
      "jurisdiction": "US",
      "registerIdentifier": {
        "scheme": "cfpb-company-product",
        "value": "Checking or savings account|CITIBANK, N.A.",
        "url": "https://www.consumerfinance.gov/data-research/consumer-complaints/search/api/v1/?company=CITIBANK%2C+N.A.&date_received_max=2025-12-31&date_received_min=2024-01-01&product=Checking+or+savings+account&size=0"
      },
      "matchEvidence": {
        "source": "https://www.consumerfinance.gov/data-research/consumer-complaints/search/api/v1/?company=CITIBANK%2C+N.A.&date_received_max=2025-12-31&date_received_min=2024-01-01&product=Checking+or+savings+account&size=0",
        "note": "Reviewed brand-to-company crosswalk. The selected company key appears exactly in the bounded CFPB product aggregation; no fuzzy name matching is used.",
        "accessed": "2026-08-14"
      },
      "review": {
        "by": "Codex Phase 7 exact company review",
        "on": "2026-08-14"
      }
    },
    {
      "cid": "banking",
      "entityCode": "us-bank",
      "entityName": "U.S. Bank",
      "entityIdentitySha256": "41bde0fef8a8f7a0312756f01c473f16d8146c52ef8f31240180c468e1be2734",
      "status": "matched",
      "legalName": "U.S. BANCORP",
      "aliases": [
        "U.S. BANCORP",
        "U.S. Bank"
      ],
      "jurisdiction": "US",
      "registerIdentifier": {
        "scheme": "cfpb-company-product",
        "value": "Checking or savings account|U.S. BANCORP",
        "url": "https://www.consumerfinance.gov/data-research/consumer-complaints/search/api/v1/?company=U.S.+BANCORP&date_received_max=2025-12-31&date_received_min=2024-01-01&product=Checking+or+savings+account&size=0"
      },
      "matchEvidence": {
        "source": "https://www.consumerfinance.gov/data-research/consumer-complaints/search/api/v1/?company=U.S.+BANCORP&date_received_max=2025-12-31&date_received_min=2024-01-01&product=Checking+or+savings+account&size=0",
        "note": "Reviewed brand-to-company crosswalk. The selected company key appears exactly in the bounded CFPB product aggregation; no fuzzy name matching is used.",
        "accessed": "2026-08-14"
      },
      "review": {
        "by": "Codex Phase 7 exact company review",
        "on": "2026-08-14"
      }
    },
    {
      "cid": "banking",
      "entityCode": "wells-fargo",
      "entityName": "Wells Fargo",
      "entityIdentitySha256": "03687ad24cbd3201d0bf09aa11b45c99d6ec6541bdc7850f45816a63992109b2",
      "status": "matched",